{
  "$schema": "../schemas/external_adoption_review.v1.schema.json",
  "schema_version": "external_adoption_review.v1",
  "reviewed_at": "2026-05-27",
  "policy": "External systems are inputs to be vetted, adapted, watched, or rejected. They must not replace Codex, research-autopilot, envctl, or the local control kernel as the main runtime.",
  "reviews": [
    {
      "upstream": "agentsmd/agents.md",
      "repo_url": "https://github.com/agentsmd/agents.md",
      "decision": "keep",
      "current_status": "absorbed as the AGENTS inheritance model",
      "accepted_patterns": [
        "root-to-project rule inheritance",
        "project rules can tighten but not expand permissions"
      ],
      "rejected_patterns": [
        "using AGENTS.md as the only control kernel"
      ],
      "controller": "research-stack-manager",
      "required_gate": "envctl validate cybernetics"
    },
    {
      "upstream": "Imbad0202/academic-research-skills",
      "repo_url": "https://github.com/Imbad0202/academic-research-skills",
      "decision": "adapt",
      "current_status": "re-reviewed on 2026-05-27; deeper pipeline, claim-audit, reviewer-contract, corpus, and temporal-integrity patterns absorbed as local contracts rather than upstream runtime",
      "accepted_patterns": [
        "task metadata and data-access annotation",
        "pipeline stages and quality gates",
        "reviewer configuration card and multi-perspective review roles",
        "two-phase reviewer sprint contract before paper-visible review",
        "re-review verification checklist and response traceability",
        "claim-reference alignment audit and uncited assertion detection",
        "citation locator and evidence-anchor discipline",
        "Material Passport as cross-session state boundary",
        "literature corpus pre-screening before external search",
        "benchmark disclosure and reproducibility lock patterns",
        "temporal integrity advisory checks"
      ],
      "rejected_patterns": [
        "bulk import of the original skill bundle",
        "Claude-Code-specific runtime orchestration as local runtime replacement",
        "claiming ARS paper-writing autonomy as social-science submission readiness proof",
        "adding every upstream lint or agent as a local hard gate before local evidence exists"
      ],
      "controller": "skill-vetter",
      "required_gate": "validate_research_pipeline"
    },
    {
      "upstream": "langchain-ai/deepagents",
      "repo_url": "https://github.com/langchain-ai/deepagents",
      "decision": "watch",
      "current_status": "reserved as a future harness adapter target",
      "accepted_patterns": [
        "checkpoint interface",
        "resume interface",
        "isolated harness boundary"
      ],
      "rejected_patterns": [
        "main runtime replacement",
        "direct takeover of Codex dispatch"
      ],
      "controller": "skill-vetter",
      "required_gate": "validate_harness_adapter_contract"
    },
    {
      "upstream": "wan-huiyan/subagent-driven-development",
      "repo_url": "https://github.com/wan-huiyan/subagent-driven-development",
      "decision": "adapt",
      "current_status": "partially absorbed as multi-agent review discipline",
      "accepted_patterns": [
        "review-first discipline",
        "integration review",
        "worktree isolation as future option"
      ],
      "rejected_patterns": [
        "mandatory full runtime orchestration layer"
      ],
      "controller": "research-team-orchestrator",
      "required_gate": "validate_agents_contract"
    },
    {
      "upstream": "obra/superpowers",
      "repo_url": "https://github.com/obra/superpowers",
      "decision": "keep",
      "current_status": "active plugin and methodology layer",
      "accepted_patterns": [
        "planning discipline",
        "execution checkpoints",
        "verification before completion"
      ],
      "rejected_patterns": [
        "replacement of local research route contracts"
      ],
      "controller": "research-stack-manager",
      "required_gate": "validate_research_stack"
    },
    {
      "upstream": "VoltAgent/awesome-codex-subagents",
      "repo_url": "https://github.com/VoltAgent/awesome-codex-subagents",
      "decision": "adapt",
      "current_status": "partially absorbed as subagent role metadata",
      "accepted_patterns": [
        "display names",
        "preferred model hints",
        "parallel safety metadata"
      ],
      "rejected_patterns": [
        "bulk installation of external subagents"
      ],
      "controller": "research-team-orchestrator",
      "required_gate": "validate_subagent_registry"
    },
    {
      "upstream": "Leey21/awesome-ai-research-writing",
      "repo_url": "https://github.com/Leey21/awesome-ai-research-writing",
      "decision": "adapt",
      "current_status": "re-reviewed on 2026-05-27 at commit c07628b; deeply absorbed as prompt-pattern adapters for manuscript writing, venue migration, figure/table wording, chart selection, and reviewer-perspective audit; upstream prompt bundle and OpenSkills install path not copied",
      "accepted_patterns": [
        "style calibration",
        "argument closure",
        "citation alignment",
        "empty phrase scan",
        "format-sensitive LaTeX versus Word translation",
        "back-translation or logic-flow check after bilingual rewriting",
        "micro shorten and expand with delta logs",
        "minimal-change English and Chinese polishing threshold",
        "AI-surface cleanup without claim changes",
        "data-bound experiment and result analysis",
        "plain figure and table title generation",
        "chart type recommendation by evidence need",
        "reviewer-perspective whole-manuscript audit",
        "fatal-versus-fixable weakness distinction",
        "conference or journal venue migration checklist"
      ],
      "rejected_patterns": [
        "generic prompt bundle copied verbatim",
        "OpenSkills install or external skill installation as a local management path",
        "current model rankings as local policy",
        "CS or LLM conference assumptions as default social-science writing structure",
        "arXiv translator runtime as a default local tool",
        "any prompt template bypassing citation, figure, peer-review, or package gates"
      ],
      "controller": "research-stack-manager",
      "required_gate": "envctl validate manuscript-writing"
    },
    {
      "upstream": "ganzhi-black/humanities-thesis-skill",
      "repo_url": "https://github.com/ganzhi-black/humanities-thesis-skill",
      "decision": "adapt",
      "current_status": "reviewed on 2026-05-27 at commit 9f9c971; selectively absorbed into manuscript-writing, writing-quality, and publication-style contracts as humanities/social-science thesis writing rules; upstream search scripts and runtime skill are not installed",
      "accepted_patterns": [
        "structured intake before humanities thesis drafting",
        "research object, problem, thesis direction, theory, paper type, and expected length confirmation",
        "theory as tool and material as destination",
        "material-first close reading and chapter opening",
        "chapter progression and transition paragraph checks",
        "quote-followed-by-analysis rule",
        "literature review grouped by argument function instead of chronology",
        "terminology consistency and bilingual glossary checks",
        "footnote function and format checks",
        "metadata-only literature entries cannot support strong paper-content claims"
      ],
      "rejected_patterns": [
        "bulk installing humanities-thesis as a separate runtime skill",
        "using upstream search.py as a replacement for local CNKI, Google Scholar, OpenAlex, Zotero, or citation-verifier workflows",
        "using upstream terminology or theorist tables as verified references",
        "claiming a paper's argument from title, abstract, citation count, or search-result metadata alone",
        "copying Claude Code or OpenClaw platform instructions into local Codex policy"
      ],
      "controller": "skill-vetter",
      "required_gate": "envctl validate manuscript-writing"
    },
    {
      "upstream": "brycewang-stanford/Awesome-Agent-Skills-for-Empirical-Research",
      "repo_url": "https://github.com/brycewang-stanford/Awesome-Agent-Skills-for-Empirical-Research",
      "decision": "adapt",
      "current_status": "reviewed on 2026-05-27 at commit e03ff8cf62f1ce8739c4181cead149da5dd84b11; deeply absorbed as an empirical quant workflow contract and academic de-template writing audit; upstream empirical and humanizer skills are not bulk-installed",
      "accepted_patterns": [
        "AER-style identification-first empirical sequence",
        "empirical question, estimand, design family, diagnostics, robustness, tables and replication as one workflow",
        "modern DID, IV, RDD, matching, synthetic control, DML and causal-ML red-flag checks",
        "full empirical analysis loop across cleaning, variables, descriptives, diagnostics, modeling, robustness, further analysis, publication outputs and replication",
        "replication package and README-first discipline",
        "academic humanization as a claim-preserving surface audit",
        "Chinese and English de-template checks for empty rhetoric, mechanical transitions, vague attribution, excessive hedging, inflated novelty and uniform rhythm",
        "second-pass writing audit after polishing"
      ],
      "rejected_patterns": [
        "bulk installing all external empirical research skills into the Codex runtime",
        "making AER or economics top-5 standards the default for all social-science papers",
        "using StatsPAI or any one-shot DSL as a black box without auditable inputs and outputs",
        "treating detector-evasion as an academic objective",